{
  "protocol_version": "0.1",
  "firm": {
    "name": "Craig Horton Advisory (demo)",
    "domain": "bvf-pillar-derivation",
    "base_model_fit_on": "offline-strong"
  },
  "institutional_memory": {
    "notes": [
      {
        "id": "note-gov-ceremonial",
        "text": "Regulatory keywords that are ceremonial rather than substantive (an audit trail with no real downstream review) should not inflate governance_risk.",
        "source": "BVF v1.0 senior-practitioner rubric"
      },
      {
        "id": "note-fin-brittle",
        "text": "High automation coverage with concentrated rework signals brittle automation; discount the modelled financial_return rather than trusting the coverage figure.",
        "source": "BVF v1.0 senior-practitioner rubric"
      },
      {
        "id": "note-integrations-plumbing",
        "text": "Integration counts often include orchestration plumbing that is not real coupling; do not over-penalise change_enablement for it.",
        "source": "BVF v1.0 senior-practitioner rubric"
      },
      {
        "id": "note-regulated-strategic",
        "text": "A regulated function in a regulated industry is more strategic than the base rubric allows; weight strategic_alignment up.",
        "source": "Craig Horton Advisory house calibration"
      },
      {
        "id": "note-kpi-owner",
        "text": "A concrete, numeric KPI paired with a named executive owner on a value function is a stronger commitment signal than the base rubric scores.",
        "source": "Craig Horton Advisory house calibration"
      }
    ],
    "exemplars": [
      {
        "features": [
          1.0,
          0.25,
          0.122,
          0.141,
          0.2,
          3.0,
          0.0,
          1.0,
          0.0,
          0.0,
          0.0,
          0.0,
          0.0,
          0.0
        ],
        "function_hint": "hr",
        "industry": "real_estate",
        "scores": {
          "strategic_alignment": 51,
          "financial_return": 17,
          "change_enablement": 42,
          "governance_risk": 58
        },
        "reward": 0.9894,
        "rationale": "Offline rubric derivation (offline-strong)."
      },
      {
        "features": [
          1.0,
          0.4,
          0.113,
          0.026,
          4.0,
          1.0,
          2.0,
          1.0,
          1.0,
          1.0,
          0.0,
          0.0,
          1.0,
          0.0
        ],
        "function_hint": "supply",
        "industry": "technology",
        "scores": {
          "strategic_alignment": 100,
          "financial_return": 33,
          "change_enablement": 59,
          "governance_risk": 39
        },
        "reward": 0.9611,
        "rationale": "Offline rubric derivation (offline-strong)."
      },
      {
        "features": [
          1.0,
          0.52,
          0.166,
          0.042,
          1.4,
          1.0,
          1.0,
          0.0,
          0.0,
          0.0,
          1.0,
          0.0,
          1.0,
          0.0
        ],
        "function_hint": "finance",
        "industry": "manufacturing",
        "scores": {
          "strategic_alignment": 20,
          "financial_return": 34,
          "change_enablement": 44,
          "governance_risk": 40
        },
        "reward": 0.9594,
        "rationale": "Offline rubric derivation (offline-strong)."
      },
      {
        "features": [
          1.0,
          0.82,
          0.053,
          0.098,
          0.4,
          8.0,
          1.0,
          0.0,
          1.0,
          0.0,
          0.0,
          0.0,
          0.0,
          1.0
        ],
        "function_hint": "it",
        "industry": "universal",
        "scores": {
          "strategic_alignment": 50,
          "financial_return": 56,
          "change_enablement": 52,
          "governance_risk": 52
        },
        "reward": 0.9608,
        "rationale": "Offline rubric derivation (offline-strong)."
      },
      {
        "features": [
          1.0,
          0.53,
          0.05,
          0.012,
          0.2,
          2.0,
          1.0,
          1.0,
          1.0,
          1.0,
          0.0,
          0.0,
          1.0,
          0.0
        ],
        "function_hint": "rd",
        "industry": "professional",
        "scores": {
          "strategic_alignment": 100,
          "financial_return": 50,
          "change_enablement": 73,
          "governance_risk": 34
        },
        "reward": 0.9589,
        "rationale": "Offline rubric derivation (offline-strong)."
      },
      {
        "features": [
          1.0,
          0.8,
          0.006,
          0.029,
          0.2,
          3.0,
          0.0,
          0.0,
          0.0,
          1.0,
          0.0,
          0.0,
          0.0,
          0.0
        ],
        "function_hint": "cx",
        "industry": "universal",
        "scores": {
          "strategic_alignment": 40,
          "financial_return": 67,
          "change_enablement": 71,
          "governance_risk": 36
        },
        "reward": 0.9839,
        "rationale": "Offline rubric derivation (offline-strong)."
      },
      {
        "features": [
          1.0,
          0.81,
          0.009,
          0.007,
          0.4,
          4.0,
          0.0,
          1.0,
          1.0,
          1.0,
          0.0,
          0.0,
          0.0,
          0.0
        ],
        "function_hint": "cx",
        "industry": "professional",
        "scores": {
          "strategic_alignment": 100,
          "financial_return": 69,
          "change_enablement": 70,
          "governance_risk": 31
        },
        "reward": 0.9839,
        "rationale": "Offline rubric derivation (offline-strong)."
      },
      {
        "features": [
          1.0,
          0.77,
          0.025,
          0.086,
          0.2,
          3.0,
          3.0,
          1.0,
          0.0,
          1.0,
          0.0,
          0.0,
          0.0,
          0.0
        ],
        "function_hint": "rd",
        "industry": "retail",
        "scores": {
          "strategic_alignment": 70,
          "financial_return": 58,
          "change_enablement": 56,
          "governance_risk": 53
        },
        "reward": 0.9882,
        "rationale": "Offline rubric derivation (offline-strong)."
      },
      {
        "features": [
          1.0,
          0.8,
          0.006,
          0.084,
          4.0,
          6.0,
          0.0,
          1.0,
          1.0,
          1.0,
          0.0,
          0.0,
          0.0,
          0.0
        ],
        "function_hint": "supply",
        "industry": "logistics",
        "scores": {
          "strategic_alignment": 100,
          "financial_return": 58,
          "change_enablement": 69,
          "governance_risk": 47
        },
        "reward": 0.98,
        "rationale": "Offline rubric derivation (offline-strong)."
      },
      {
        "features": [
          1.0,
          0.44,
          0.012,
          0.077,
          1.4,
          1.0,
          0.0,
          1.0,
          1.0,
          1.0,
          0.0,
          1.0,
          0.0,
          0.0
        ],
        "function_hint": "cx",
        "industry": "public_sector",
        "scores": {
          "strategic_alignment": 100,
          "financial_return": 42,
          "change_enablement": 74,
          "governance_risk": 45
        },
        "reward": 0.976,
        "rationale": "Offline rubric derivation (offline-strong)."
      },
      {
        "features": [
          1.0,
          0.2,
          0.085,
          0.058,
          2.2,
          7.0,
          1.0,
          0.0,
          0.0,
          1.0,
          0.0,
          0.0,
          0.0,
          0.0
        ],
        "function_hint": "rd",
        "industry": "technology",
        "scores": {
          "strategic_alignment": 40,
          "financial_return": 24,
          "change_enablement": 53,
          "governance_risk": 45
        },
        "reward": 0.9805,
        "rationale": "Offline rubric derivation (offline-strong)."
      },
      {
        "features": [
          1.0,
          0.08,
          0.009,
          0.077,
          0.6,
          2.0,
          2.0,
          0.0,
          0.0,
          1.0,
          0.0,
          0.0,
          0.0,
          0.0
        ],
        "function_hint": "cx",
        "industry": "nonprofit",
        "scores": {
          "strategic_alignment": 40,
          "financial_return": 25,
          "change_enablement": 73,
          "governance_risk": 49
        },
        "reward": 0.9884,
        "rationale": "Offline rubric derivation (offline-strong)."
      },
      {
        "features": [
          1.0,
          0.79,
          0.15,
          0.059,
          4.0,
          2.0,
          2.0,
          0.0,
          1.0,
          0.0,
          1.0,
          0.0,
          0.0,
          1.0
        ],
        "function_hint": "risk",
        "industry": "real_estate",
        "scores": {
          "strategic_alignment": 50,
          "financial_return": 46,
          "change_enablement": 43,
          "governance_risk": 46
        },
        "reward": 0.9631,
        "rationale": "Offline rubric derivation (offline-strong)."
      },
      {
        "features": [
          1.0,
          0.65,
          0.108,
          0.117,
          0.9,
          5.0,
          1.0,
          0.0,
          1.0,
          1.0,
          0.0,
          0.0,
          0.0,
          0.0
        ],
        "function_hint": "sales",
        "industry": "manufacturing",
        "scores": {
          "strategic_alignment": 70,
          "financial_return": 39,
          "change_enablement": 40,
          "governance_risk": 55
        },
        "reward": 0.9816,
        "rationale": "Offline rubric derivation (offline-strong)."
      },
      {
        "features": [
          1.0,
          0.19,
          0.02,
          0.081,